{
  "id": "AUT-START-AUT-PR-ENT-PORTFOLIO-R4",
  "kind": "delivery_start_receipt",
  "schema_version": "delivery-start-receipt:v1",
  "profile_ref": {
    "id": "AUT-PR-ENT-PORTFOLIO-R4",
    "path": ".sdlc/autonomy/deliveries/AUT-PR-ENT-PORTFOLIO-R4.json",
    "hash": "ebd7ef768dbad2ddbf8d8de3875b56d8b73dfb9ef53fda5da48f38f25e666dc1"
  },
  "delivery": {
    "id": "PR-ENT-PORTFOLIO-R4",
    "kind": "pull_request"
  },
  "story_ref": {
    "id": "ST-ENT-PORTFOLIO-R2",
    "path": ".sdlc/stories/ST-ENT-PORTFOLIO-R2/story.json",
    "hash": "b58e9b9b60f87afdb43b041cd25f728073e0ce16b2bf73a644a89bb0dc50ec89"
  },
  "contract_ref": {
    "id": "contract-ST-ENT-PORTFOLIO-R2-implementation-v4",
    "path": ".sdlc/contracts/contract-ST-ENT-PORTFOLIO-R2-implementation-v4.json",
    "hash": "c4e2774a2bf2f989c96cc2fd60d490e0576e58b2e86fe04bf4bb0a73a2a8535d"
  },
  "contract_approval_hash": "c4e2774a2bf2f989c96cc2fd60d490e0576e58b2e86fe04bf4bb0a73a2a8535d",
  "phase": "implementation",
  "route": "claim_and_implement",
  "autonomy_decision_ref": {
    "id": "AUT-DEC-20260719015326314-c98f8b",
    "path": ".sdlc/autonomy/decisions/AUT-DEC-20260719015326314-c98f8b.json",
    "hash": "e0b9e38812fa19d384065f0f2d513afe96e0447e2e106cc5e43ffb626e4dc2a9"
  },
  "effective_level": "checkpointed",
  "start_basis": "checkpointed-profile",
  "status": "started",
  "started_by": {
    "id": "codex",
    "type": "agent",
    "name": "Codex",
    "email": null,
    "source": "default"
  },
  "started_at": "2026-07-19T01:53:26.591Z",
  "audit": {
    "git": {
      "is_git_repo": true,
      "branch": "codex/ST-ENT-PORTFOLIO",
      "head_sha": "6acce0d1d5dfb45e49a0eac83cf7c5f547a7684f",
      "is_dirty": true,
      "user": {
        "name": "Antonio Antenore",
        "email": "ant_ant95@hotmail.it"
      },
      "remotes": [
        "origin"
      ]
    },
    "run": {
      "run_id": null,
      "thread_id": "019f6f22-ba84-7631-bdaf-b074e51dba5d",
      "session_id": null,
      "tool": "agentic-sdlc-cli",
      "version": "0.11.0"
    }
  },
  "receipt_hash": "fe0789612804e6eae1a387b8802086b3447e4ae3d1575133b4c2121af0c69ec0",
  "hash_algorithm": "sha256:stable-json:v1"
}
