{
  "id": "AUT-START-AUT-PR-ENT-GOVERNANCE",
  "kind": "delivery_start_receipt",
  "schema_version": "delivery-start-receipt:v1",
  "profile_ref": {
    "id": "AUT-PR-ENT-GOVERNANCE",
    "path": ".sdlc/autonomy/deliveries/AUT-PR-ENT-GOVERNANCE.json",
    "hash": "41dfdef31bbfd52d601e26d158ed1f1db65b05646bab72118bd9e3b1a88dc231"
  },
  "delivery": {
    "id": "PR-ENT-GOVERNANCE",
    "kind": "pull_request"
  },
  "story_ref": {
    "id": "ST-ENT-GOVERNANCE",
    "path": ".sdlc/stories/ST-ENT-GOVERNANCE/story.json",
    "hash": "cdc9908a1bff13a0232e9385dc83cbb46322dfbc2470f42fc29a6db49bca3b56"
  },
  "contract_ref": {
    "id": "contract-ST-ENT-GOVERNANCE-implementation",
    "path": ".sdlc/contracts/contract-ST-ENT-GOVERNANCE-implementation.json",
    "hash": "c6a89b6fe33cbdc0684d88f1f6ea318cbab7f333cb8c779d415e6de799f1063c"
  },
  "contract_approval_hash": "c6a89b6fe33cbdc0684d88f1f6ea318cbab7f333cb8c779d415e6de799f1063c",
  "phase": "implementation",
  "route": "claim_and_implement",
  "autonomy_decision_ref": {
    "id": "AUT-DEC-20260718203802701-e564be",
    "path": ".sdlc/autonomy/decisions/AUT-DEC-20260718203802701-e564be.json",
    "hash": "32175791819c2eb7fdf53584475ddef73fee6c31eeb3840b2debd7e8c5d2af2e"
  },
  "effective_level": "checkpointed",
  "start_basis": "checkpointed-profile",
  "status": "started",
  "started_by": {
    "id": "codex",
    "type": "agent",
    "name": "Codex",
    "email": null,
    "source": "default"
  },
  "started_at": "2026-07-18T20:38:02.994Z",
  "audit": {
    "git": {
      "is_git_repo": true,
      "branch": "codex/ST-ENT-GOVERNANCE",
      "head_sha": "77880a5a45e794eecb31d92270847235ecac4cd5",
      "is_dirty": true,
      "user": {
        "name": "Antonio Antenore",
        "email": "ant_ant95@hotmail.it"
      },
      "remotes": [
        "origin"
      ]
    },
    "run": {
      "run_id": null,
      "thread_id": "019f6f22-ba84-7631-bdaf-b074e51dba5d",
      "session_id": null,
      "tool": "agentic-sdlc-cli",
      "version": "0.11.0"
    }
  },
  "receipt_hash": "a60524e0a72fecd612e98dcb879a572a48617b1a5b0e6cc0a2e924ba90bec9da",
  "hash_algorithm": "sha256:stable-json:v1"
}
