{
  "id": "AUT-START-AUT-PR-NOVICE-PLUGIN-JOURNEY-002",
  "kind": "delivery_start_receipt",
  "schema_version": "delivery-start-receipt:v1",
  "profile_ref": {
    "id": "AUT-PR-NOVICE-PLUGIN-JOURNEY-002",
    "path": ".sdlc/autonomy/deliveries/AUT-PR-NOVICE-PLUGIN-JOURNEY-002.json",
    "hash": "fed96d591deb92b91e7b9334661d6773dc2b24908262c3740d0e92cf5c0ca3a9"
  },
  "delivery": {
    "id": "PR-NOVICE-PLUGIN-JOURNEY-001",
    "kind": "pull_request"
  },
  "story_ref": {
    "id": "ST-NOVICE-PLUGIN-JOURNEY",
    "path": ".sdlc/stories/ST-NOVICE-PLUGIN-JOURNEY/story.json",
    "hash": "901d6cda8bdfbfab40b1aad4fbba759f5880db7f064e4fa8d62aef50ec7c6e9b"
  },
  "contract_ref": {
    "id": "contract-ST-NOVICE-PLUGIN-JOURNEY-implementation-v2",
    "path": ".sdlc/contracts/contract-ST-NOVICE-PLUGIN-JOURNEY-implementation-v2.json",
    "hash": "712bad805e3c8e5b10085d6e0518d0314cf743f30b4fa447392bec33a9e24c40"
  },
  "contract_approval_hash": "712bad805e3c8e5b10085d6e0518d0314cf743f30b4fa447392bec33a9e24c40",
  "phase": "implementation",
  "route": "claim_and_implement",
  "autonomy_decision_ref": {
    "id": "AUT-DEC-20260726181707875-e23354",
    "path": ".sdlc/autonomy/decisions/AUT-DEC-20260726181707875-e23354.json",
    "hash": "b6690075a8c04f442c241b8e6e5086ada17d5a92a9fefadaaaf55476d475037e"
  },
  "effective_level": "checkpointed",
  "start_basis": "checkpointed-profile",
  "status": "started",
  "started_by": {
    "id": "codex",
    "type": "agent",
    "name": "Codex",
    "email": null,
    "source": "default"
  },
  "started_at": "2026-07-26T18:17:08.425Z",
  "audit": {
    "git": {
      "is_git_repo": true,
      "branch": "codex/ST-NOVICE-PLUGIN-JOURNEY",
      "head_sha": "b656b83b8a101b0c16bd914286c22872e979da24",
      "is_dirty": true,
      "user": {
        "name": "Antonio Antenore",
        "email": "ant_ant95@hotmail.it"
      },
      "remotes": [
        "origin"
      ]
    },
    "run": {
      "run_id": null,
      "thread_id": "019f6f22-ba84-7631-bdaf-b074e51dba5d",
      "session_id": null,
      "tool": "agentic-sdlc-cli",
      "version": "0.12.0"
    }
  },
  "receipt_hash": "a7fb2ee804e88997e3753e681da30cd612bec79d56d1161809b6d4057ba638e5",
  "hash_algorithm": "sha256:stable-json:v1"
}
