{
  "id": "AUT-START-AUT-PR-ENT-UX-V2",
  "kind": "delivery_start_receipt",
  "schema_version": "delivery-start-receipt:v1",
  "profile_ref": {
    "id": "AUT-PR-ENT-UX-V2",
    "path": ".sdlc/autonomy/deliveries/AUT-PR-ENT-UX-V2.json",
    "hash": "ea87291deec8493087104db8bda903809350cd3cacfb2f80bc79013eab38d608"
  },
  "delivery": {
    "id": "PR-ENT-UX",
    "kind": "pull_request"
  },
  "story_ref": {
    "id": "ST-ENT-UX",
    "path": ".sdlc/stories/ST-ENT-UX/story.json",
    "hash": "d574633dec189b2676e3ad45f67c05ec2ab3381c49bf67f3916a58ec88032412"
  },
  "contract_ref": {
    "id": "contract-ST-ENT-UX-implementation",
    "path": ".sdlc/contracts/contract-ST-ENT-UX-implementation.json",
    "hash": "e38a4e424256236babecb87c6c1fd0685aa616fdd637726566c5d25832a19576"
  },
  "contract_approval_hash": "e38a4e424256236babecb87c6c1fd0685aa616fdd637726566c5d25832a19576",
  "phase": "implementation",
  "route": "claim_and_implement",
  "autonomy_decision_ref": {
    "id": "AUT-DEC-20260718003117072-871327",
    "path": ".sdlc/autonomy/decisions/AUT-DEC-20260718003117072-871327.json",
    "hash": "bd02bb2567de88dcb67929a719c15ec17945f9deffc70e2d75581b962e1afe1d"
  },
  "effective_level": "checkpointed",
  "start_basis": "checkpointed-profile",
  "status": "started",
  "started_by": {
    "id": "codex",
    "type": "agent",
    "name": "Codex",
    "email": null,
    "source": "cli"
  },
  "started_at": "2026-07-18T00:31:17.373Z",
  "audit": {
    "git": {
      "is_git_repo": true,
      "branch": "codex/ST-ENT-UX",
      "head_sha": "7465944ac2f22b335fafdae9a006d338509c31fc",
      "is_dirty": true,
      "user": {
        "name": "Antonio Antenore",
        "email": "ant_ant95@hotmail.it"
      },
      "remotes": [
        "origin"
      ]
    },
    "run": {
      "run_id": null,
      "thread_id": "019f6f22-ba84-7631-bdaf-b074e51dba5d",
      "session_id": null,
      "tool": "agentic-sdlc-cli",
      "version": "0.11.0"
    }
  },
  "receipt_hash": "5fe01a2c90de2b9a4e4ca769c168f8e7b294c1fd1229f2536b5194a447c844b2",
  "hash_algorithm": "sha256:stable-json:v1"
}
